clave_paper,num_ref,texto_raw,anio_citado,categoria,subcategoria,journal_detectado
2012-13,30,"Nardo, M. (2003). “The quantification of qualitative survey data: A critical assessment”, Journal of Economic Surveys, Vol. 17, No. 5, pp. 645-668. OECD (2003). Business Tendency Surveys: A Handbook, OECD Publications, France.",2003,ortodoxo,otros_mainstream,Journal of Economic Surveys
2012-13,31,"Pesaran, M. H., Timmermann, A. (1992). “A Simple Nonparametric Test of Predictive Performance”, Journal of Business & Economic Statistics, Vol. 10, No. 4 (October), pp. 461-465.",1992,ortodoxo,econometria,Journal of Business & Economic Statistics
2012-13,32,"Pesaran, M. H., Weale, M. (2006). “Survey Expectations” in Elliott, G., Granger, C., Timmerman, A., Handbook of Economic Forecasting, North-Holland Publishing Co., The Netherlands, Vol. 1, Chapter 14.",2006,ortodoxo,libro_mainstream,Libro (North-Holland)
2012-13,33,"Prasetyo, N. H., Yuliatiningsih, R. (2008). “Bank of Indonesia Consumer Survey”, Report, Bank of Indonesia.",2008,desconocido,desconocido,
2012-13,34,"Siegel, S., Castellan, N. J. (1988). Non Parametric Statistics for the Behavioral Sciences, 2nd edition, McGraw-Book Company, New York.",1988,desconocido,desconocido,
2012-13,35,"Thomas, L. B. (1999). “Survey Measures of Expected US Inflation”, Journal of Economic Perspectives, Vol. 13, No. 4, pp. 125-144.",1999,ortodoxo,otros_mainstream,Journal of Economic Perspectives
2012-13,36,"Visco, I. (1984). Price Expectations in Rising Inflation, North-Holland Publishing Co., Amsterdam.",1984,ortodoxo,libro_mainstream,Libro (North-Holland)
2012-13,37,"Zhou, X., Obuchowski, N., McClish, D. (2002). Statistical Methods in Diagnostic Medicine, Wiley-Interscience. 56",2002,ortodoxo,libro_mainstream,Libro (Wiley)
2012-08,1,"Abarca, G.L., G.Benavides, and J.G. Rangel, (2012). Exchange Rate Market Expectations and Central Bank Policy: The case of the Mexican Peso-US Dollar from 2005-2009. The Journal of Derivatives, Vol. 19, No. 4 pp 70-90. Bank of International Settlements (2010) Triennial Central Bank Survey: Report on global foreign exchange market activity in 2010. Monetary and Economic Department. December 2010.",2012,institucional,wp_multilateral,BIS Working Paper
2012-08,2,"Bliss, R., and Panigirtzoglou, N., (2004). Option-Implied Risk Aversion Estimates. Journal of Finance, 59 (1), 407-446.",2004,ortodoxo,finanzas,Journal of Finance
2012-08,3,"Breeden, D., and R. Litzenberger, (1978). Prices of State-Contingent Claims Implied in Option Prices. Journal of Business, 51, 621-651.",1978,ortodoxo,econometria,Journal of Business & Economic Statistics
2012-08,4,"Buch, CM., R.P. Heinrich, and C. Pierdzioch. (1998). Taxing Short-Term Capital Flows An Option for. Transition Economies? Kiel Discussion Papers 321.",1998,desconocido,desconocido,
2012-08,5,"Campa, J., K. Chang, R. Reidner. (1997). Implied Exchange Rate Distributions: Evidence from the OTC Option Markets, NBER Working paper no. 6179. Clews R., N. Panigirtzoglou and J. Proudman (2000). Recent Developments in Extracting Information from Option Markets. Bank of England Quarterly Bulletin, February pp. 50-60.",1997,institucional,wp_multilateral,NBER Working Paper
2012-08,6,"Disyatat, P., and G.Galati (2007). The Effectiveness of Foreign Exchange Market: Intervention in Emerging Market Countries: Evidence from the Czech Koruna. Journal of International Money and Finance, 26, 383–402.",2007,ortodoxo,internacional,Journal of International Money and Finance
2012-08,7,"Edwards, S. (1998). Capital Flows, Real Exchange Rates and Capital Controls: Some Latin American Experiences. NBER Working Paper 6800.",1998,institucional,wp_multilateral,NBER Working Paper
2012-08,8,"Edwards, S. (2001), Capital Flows and Economic Performance: Are Emerging Economies Different? NBER Working Paper no. 8076 (January).",2001,institucional,wp_multilateral,NBER Working Paper
2012-08,9,"Eichengreen, B. (2001). Capital account liberalization: What do the cross-country studies tell us? World Bank Economic Review, 15:341-365. 33",2001,institucional,wp_multilateral,World Bank
2012-08,10,"Figlewski, S. (2009). Estimating the Implied Risk-Neutral Density for the U.S. Market Portfolio.Volatility and Time Series Econometrics: Essays in Honor of Robert F. Engle (Eds. Tim Bollerslev, Jeffrey Rusell and Mark Watson). Oxford, UK: Oxford University Press.",2009,ortodoxo,libro_mainstream,Libro (Oxford University Press)
2012-08,11,"Frankel, J. (1996). How Well Do Foreign Exchange Market Works: Might a Tobin Tax Help? In The Tobin Tax: Coping with Financial Volatility, Haq, M. ul, I. Kaul and I. Grunberg, eds., Oxford University Press, pp. 41-81.",1996,ortodoxo,libro_mainstream,Libro (Oxford University Press)
2012-08,12,"Frenkel, M., C.Nickel, G. Schmidt, and G. Stadmann. (2001). The Effects of Capital Controls on Exchange Rate Volatility and Output. IMF Working Paper. International Monetary Fund: Strategy, Policy, and Review Department. (2011). Recent Experiences in Managing Capital Inflows—Cross-Cutting Themes and Possible Policy Framework. IMF Working Paper. International Monetary Fund. (2010). World Economic O",2001,ortodoxo,tier1_generalist,American Economic Review
2012-08,13,"Kaminsky, G. L. and Lewis, K. K. (1996). Does Foreign Exchange Intervention Signal Future Monetary Policy?, Federal Reserve Bank of Philadelphia.Working Paper No. 96-7. Korinek A. (2011). Systemic Risk-taking: Amplification Effects, Externalities, and Regulatory Responses, Working Paper Series 1345, European Central Bank.",1996,institucional,wp_bc_avanzado,Federal Reserve
2012-08,14,"Lewis, K. K. (1995). Occasional Intervention to Target Rates. American Economic Review, 84(5):691–715.",1995,ortodoxo,tier1_generalist,American Economic Review
2012-08,15,"Malz, A. M. (1997). Estimating the Probability Distribution of the Future Exchange Rate from Option Prices. Journal of Derivatives, 5, 18-36.",1997,desconocido,desconocido,
2012-08,16,"Magud, N., C. Reinhart, and K. Rogoff. (2011). Capital Controls: Myth and Reality – A Portfolio Balance Approach, PIIE Working Papers No. 11-7. 34",2011,desconocido,desconocido,
2012-08,17,"Montoro, C., and Moreno R. (2011). The Use of Reserve Requirements as a Policy Instrument in Latin America, BIS Quarterly Review, March 2011.",2011,desconocido,desconocido,
2012-08,18,"Neely, C. J. (2001). The Practice of Central Bank Intervention: Looking under the Hood. Federal Reserve Bank of St. Louis Review, 83(3):1–10. Ostry, J., A. Ghosh, K. Habermeier, M. Chamon, M. Qureshi, and D. Reinhardt. (2010). Capital Inflows: The Role of Controls, IMF Staff Position Note. Washington, DC: IMF. Ostry, J., A. Ghosh, K. Habermeier, L. Laeven, M. Chamon, M. Qureshi, and A. Kokenyne. (",2001,institucional,wp_multilateral,IMF Staff Papers
2012-08,19,"Quinn, P. (1997), The Correlates of Changes in International Financial Regulation, American Political Science Review 91, pp. 531-551. Reinhart C. and V. Reinhart, (1999). On the Use of Reserve Requirements to Deal with the Capital Flow Problem. International Journal of Finance and Economics, 41, pp. 27–54.",1997,ortodoxo,finanzas,Journal of Finance
2012-08,20,"Reinhart, C., and T. Smith. (1998). Too Much of a Good Thing. The Macroeconomic Effects of Taxing Capital Inflows. In Managing Capital Flows and Exchange Rates: Perspectives from the Pacific Basin, R. Glick, ed., Cambridge: Cambridge University Press, pp. 436-464.",1998,ortodoxo,libro_mainstream,Libro (Cambridge University Press)
2012-08,21,"Rodrik, D. (1998), Who Needs Capital-Account Convertibility? in Peter Kenen (ed), Should the IMF Pursue Capital Account Convertibility? Essays in International Finance no. 207, Princeton: Princeton University Press (May).",1998,ortodoxo,libro_mainstream,Libro (Princeton University Press)
2012-08,22,"Shimko, D., (1993), Bounds of Probability, Risk 6, 33-37.",1993,desconocido,desconocido,
2012-08,23,"Tobin, J. (1974). The New Economics One Decade Older. The Elliot Janeway Lectures on Historical Economics in Honor of Joseph Schumpeter. Princeton: Princeton University Press.",1974,ortodoxo,libro_mainstream,Libro (Princeton University Press)
2012-08,24,"Wooldridge, J. (2009). Introductory Econometrics: a Modern Approach, South-Western Cengage Learning, edition 4, volume 1, number 1234567121110090. Pages 316-318. 35 Appendix 1: Description of Measures Implemented by Selected Emerging Economies A.1 Brazil Brazil implemented various measures, including mechanisms such as tax modifications. The measures taken during the sample period are the followin",2009,desconocido,desconocido,
2012-08,25,"28 This requirement is planned to increase to 8% in June 2011. 38 country. Finally, the foreign currency liquidity coefficient was increased from 90% to 100% and the ratio of financing in foreign loan portfolios was increased from medium- to long-term. Moreover, Bank of Korea and FSS implemented audits of national and foreign banks to ensure that these institutions located in South Korea maintain ",2011,desconocido,desconocido,
2011-17,1,"Aikman, D., Alessandri, P., Eklund, B., Gai, P., Kapadia, S., Martin, E.,",,desconocido,desconocido,
2011-17,2,"Mora, N., Sterne, G., Willison, M., 2009. Funding Liquidity Risk in a Quantitative Model of Systemic Stability. Bank of England.",2009,institucional,wp_bc_avanzado,Bank of England
2011-17,3,"Angelini, P., Neri, S., Panetta, F., 2010. Monetary and Macroprudential Policies. Bank of Italy.",2010,desconocido,desconocido,
2011-17,4,"Angeloni, I., Faia, E., 2009. A Tale of Two Policies: Prudential Regulation and Monetary Policy with Fragile Banks, mimeo. Baily, M., Campbell, J., Cochrane, J., Diamond, D., Du¢ e, D., French, K.,",2009,desconocido,desconocido,
2011-17,5,"Kashyap, A., Mishkin, F., Rajan, R., Shiller, R., 2010. The Squam Lake Report: Fixing the Financial System. Princeton University Press. Banxico, 2010. Reporte del Sistema Financiero. Banco de México.",2010,institucional,wp_banxico,Banco de México WP
2011-17,6,"Barrell, R., Gottschalk, S., 2006. The Impacts of Capital Adequacy Require- ments on Emerging Markets. Working Paper, National Institute of Eco- nomic and Social Research, London.",2006,desconocido,desconocido,
2011-17,7,"Beau, D., Clerc, L., Mojon, B., 2011. Macroprudential Policy and the Con- duct of Monetary Policy. Banque de France Occasional Paper.",2011,desconocido,desconocido,
2011-17,8,"Borio, C., Disyatat, P., 2010. Unconventional Monetary Policies: An Ap- praisal. The Manchester School 78 (s1), 53–89.",2010,desconocido,desconocido,
2011-17,9,"Caruana, J., 2010. Basel III: Towards a Safer Financial System, speech at the 3rd Santander International Banking Conference, Madrid.",2010,desconocido,desconocido,
2011-17,10,"Cecchetti, S., Gyntelberg, J., Hollanders, M., 2009. Central Counterparties for Over-the-counter Derivatives. BIS Quarterly Review.",2009,desconocido,desconocido,
2011-17,11,"Christiano, L., Ilut, C., Motto, R., Rostagno, M., 2010. Monetary Policy and Stock Market Booms. NBER Working Paper.",2010,institucional,wp_multilateral,NBER Working Paper
2011-17,12,"Clarida, R., Gali, J., Gertler, M., 1999. The Science of Monetary Policy: A New Keynesian Perspective. Journal of Economic Literature 37 (4), 1661– 1707.",1999,ortodoxo,otros_mainstream,Journal of Economic Literature
2011-17,13,"Covas, F., Fujita, S., 2009. Time-varying Capital Requirements in a General EquilibriumModelofLiquidityDependence,mimeo,FederalReserveBank of Philadelphia. 25 Curdia, V., Woodford, M., 2010a.CreditSpreadsandMonetaryPolicy.Jour- nal of Money, Credit and Banking 42, 3–35. Curdia, V., Woodford, M., 2010b. The Central Bank Balance Sheet as an Instrument of Monetary Policy. NBER Working Paper.",2009,institucional,wp_multilateral,NBER Working Paper
2011-17,14,"Dib, A., 2010. Banks, Credit Market Frictions and Business Cycles, mimeo, Bank of Canada.",2010,institucional,wp_bc_avanzado,Bank of Canada
2011-17,15,"Erceg, C., Henderson, D., Levin, A., 2000. Optimal Monetary Policy with Staggered Wage and Price Contracts. Journal of Monetary Economics 46 (2), 281–313. Freedman, C., Johnson, M., Kriljenko, C., Ivan, J., Garcia-Saltos, R., Lax- ton, D., 2009. Adding Latin America to the Global Projection Model. IMF Working Papers 9085 (200), 1–48.",2000,ortodoxo,macro_monetario,Journal of Monetary Economics
2011-17,16,"Galati, G., Moessner, R., 2011. Macroprudential Policy - A Literature Re- view. BIS Working Paper No. 337.",2011,institucional,wp_multilateral,BIS Working Paper
2011-17,17,"Gertler, M., Karadi, P., 2009. A Model of Unconventional Monetary Policy, mimeo, New York University.",2009,desconocido,desconocido,
2011-17,18,"Gertler, M., Kiyotaki, N., 2010. Financial Intermediation and Credit Policy in Business Cycle Analysis. Handbook of Monetary Economics.",2010,desconocido,desconocido,
2011-17,19,"Goodhart, C., 2009. The Regulatory Response to the Financial Crisis. Ed- ward Elgar Publishing.",2009,desconocido,desconocido,
2011-17,20,"Goodhart, C., 2010. The changing role of central banks. Bank for Interna- tional Settlements, Monetary and Economic Department. Macroeconomic-Assessment-Group,2010a.AssessingtheMacroeconomicIm- pact of the Transition to Stronger Capital and Liquidity Requirements. Bank for International Settlements, Basel. Macroeconomic-Assessment-Group, 2010b. Assessing the Macroeconomic Impact of the Transition ",2010,desconocido,desconocido,
2011-17,21,"Meh, C., Moran, K., 2010. The Role of Bank Capital in the Propagation of Shocks. Journal of Economic Dynamics and Control 34 (3), 555–576.",2010,ortodoxo,macro_monetario,Journal of Economic Dynamics and Control
2011-17,22,"Sidaoui, J., Ramos-Francia, M., 2008. The Monetary Transmission Mecha- nism in Mexico: Recent Developments. BIS Papers chapters 35, 363–394. 26",2008,desconocido,desconocido,
2011-17,23,"Smets, F., Wouters, R., 2003. An Estimated Dynamic Stochastic General Equilibrium Model of the Euro Area. Journal of the European Economic Association 1 (5), 1123–1175.",2003,ortodoxo,otros_mainstream,Journal of the European Economic Association
2011-17,24,"Soderlind, P., 1999. Solution and Estimation of RE Macromodels with Op- timal Policy. European Economic Review 43, 813–823. 27",1999,ortodoxo,otros_mainstream,European Economic Review
2011-14,1,"[1] Adolfson, M., S. Laseen, J. Lindé, and M. Villani. 2008. Evaluating an estimated New Key- nesian small open economy model. Journal of Economic Dynamics and Control, Vol. 32 (8), 2690-2721.",2008,ortodoxo,macro_monetario,Journal of Economic Dynamics and Control
2011-14,2,"[2] Arellano, C.andE.Mendoza.2002.Creditfrictionsandsuddenstopsinsmallopeneconomies: an equilibrium business cycle framework for emerging market crises. NBER Working Paper 8880.",2002,institucional,wp_multilateral,NBER Working Paper
2011-14,3,[3] BID. 2008. All that glitters may not be gold: assessing Latin America recent macroeconomic performance.,2008,desconocido,desconocido,
2011-14,4,"[4] Bosworth, B.P. and S.M. Collins. 1999. Capital flows to developing economies: implications for saving and investment. Brookings Papers on Economic Activity, Vol. 30 (1), 143-180.",1999,ortodoxo,macro_monetario,Brookings Papers on Economic Activity
2011-14,5,"[5] Calvo, G. 1998. Capital flows and capital-market crises: the simple economics of sudden stops. Journal of Applied Economics, Vol. 1, 35-54.",1998,desconocido,desconocido,
2011-14,6,"[6] Capistrán, C. and M. Ramos-Francia. 2009. Inflation dynamics in Latin America. Contempo- rary Economic Policy, Vol. 27(3), 349-362.",2009,ortodoxo,otros_mainstream,Economic Policy
2011-14,7,"[7] Capistrán, C. and M. Ramos-Francia. 2010. Does inflation targeting affect the dispersion of inflation expectations?. Journal of Money, Credit and Banking, Vol. 42(1), 113-134.",2010,ortodoxo,macro_monetario,"Journal of Money, Credit and Banking"
2011-14,8,"[8] Christiano,L.,M.Eichenbaum,andC.Evans.2005.Nominalrigiditiesandthedynamiceffects of a shock to monetary policy. Journal of Political Economy, Vol. 113(1), 1-45.",2005,ortodoxo,tier1_generalist,Journal of Political Economy
2011-14,9,"[9] Cuadra G., J.M. Sanchez, and H. Sapriza. 2010. Default risk and fiscal policy in emerging markets. Review of Economic Dynamics, Vol. 13(2), 452-469.",2010,desconocido,desconocido,
2010-17,1,"Aït-Sahalia, Y., and Lo, A. (1998). Nonparametric Estimation of State-Price Densities Implicit in Financial Asset Prices. Journal of Finance, 53, 499-547. Andersen T. G., and Bollerslev T. (1998). Deutsche Mark-Dollar Volatility: Intraday Activity Patterns, Macroeconomics Announcements, and Longer Run Dependencies. Journal of Finance, 53, 219-265. Andersen T. G., Bollerslev T., Diebold F. X. and V",1998,ortodoxo,tier1_generalist,American Economic Review
2010-17,2,"Bahra, B. (1997). Implied Risk Neutral Probability Density Functions from Options Prices: Theory and Application. Bank of England. Working Paper No. 66.",1997,institucional,wp_bc_avanzado,Bank of England
2010-17,3,"Bates, D. S., (1991). The Crash of '87: Was It Expected? The Evidence from Options Markets. Journal of Finance, 46, 1009-44.",1991,ortodoxo,finanzas,Journal of Finance
2010-17,4,"Benavides, G. and Capistrán, C. (2009). Forecasting Exchange Rate Volatility: The Superior Performance of Conditional Combinations of Time Series and Option Implied Forecasts. Banco de México. Documento de Investigación No. 2009-01.",2009,institucional,wp_banxico,Banco de México WP
2010-17,5,"Benavides, G., and Mora F. I. (2008). Parametric vs. Non-Parametric Methods for Estimating Option Implied Risk-Neutral Densities: The Case of the Exchange Rate Mexican Peso - US Dollar. Ensayos, 27, 33-52.",2008,desconocido,desconocido,
2010-17,6,"Bernanke, B. S., and Kuttner K. (2005). What Explains the Stock Market’s Reaction to Federal Reserve Policy? Journal of Finance, 60, 1221-1257.",2005,ortodoxo,finanzas,Journal of Finance
2010-17,7,"Birru, J. and Figlewski, S. (2010). Anatomy of a Meltdown: The Risk Neutral Density for the S&P 500 in the Fall of 2008. Working Paper NYU. Revised Feb. 2010.",2010,desconocido,desconocido,
2010-17,8,"Black, F. and Scholes, M. S. (1973). The Pricing of Options and Corporate Liabilities. Journal of Political Economy, 81, 637-654. 21",1973,ortodoxo,tier1_generalist,Journal of Political Economy
2010-17,9,"Bliss, R., and Panigirtzoglou, N. (2002). Testing the Stability of Implied Probability Density Functions. Journal of Banking and Finance, 26 , 381-422.",2002,ortodoxo,finanzas,Journal of Banking and Finance
2010-17,10,"Bomfim, A. N. (2003). Pre-announcement Effects, News Effects, and Volatility: Monetary Policy and the Stock Market. Journal of Banking and Finance, 27, 133-151.",2003,ortodoxo,finanzas,Journal of Banking and Finance
2010-17,11,"Breeden, D., and Litzenberger, R. (1978). Prices of State-Contingent Claims Implicit in Option Prices. Journal of Business, 51, 621-651.",1978,ortodoxo,econometria,Journal of Business & Economic Statistics
2010-17,12,"Castrén, O. (2005). Estimating and Analyzing Currency Options Implied Risk-Neutral Density Functions for the Largest New EU Member Status. European Central Bank. Working Paper No. 440.",2005,institucional,wp_bc_avanzado,ECB Working Paper
2010-17,13,"Cooper, N., and Talbot, J. (1999). The Yen/Dollar Exchange Rate in 1998: Views from Options Markets. Bank of England. Working Paper. Díaz de León, A., and Casanova, M. E. (2004). Expectativas del Mercado Implícitas en los Precios de Instrumentos Derivados: Aplicaciones al Mercado Cambiario y Petrolero. Banco de México. Documento de investigación No. 2004 01.",1999,institucional,wp_banxico,Banco de México WP
2010-17,14,"Evans, C.L., and Kuttner, K.N., (1998). Monetary Policy Surprises and Interest Rates: Evidence from the Fed Funds Futures Market. Journal of Monetary Economics, 47, 523-544.",1998,ortodoxo,macro_monetario,Journal of Monetary Economics
2010-17,15,"Figlewski, S. (2009). Estimating the Implied Risk-Neutral Density for the U.S. Market Portfolio. Volatility and Time Series Econometrics: Essays in Honor of Robert F. Engle (Eds. Tim Bollerslev, Jeffrey Rusell and Mark Watson). Oxford, UK: Oxford University Press.",2009,ortodoxo,libro_mainstream,Libro (Oxford University Press)
2010-17,16,"Flannery, M., and Protopapadakis A. (2002). Macroeconomic Factors Do Influence Aggregate Stock Returns. Review of Financial Studies, 15, 751-782. Fleming M. J., and Remolona E. M. (1999). Price Formation and Liquidity in the U.S. Treasury Market: The Response to Public Information. Journal of Finance, 54, 1901-1915.",2002,ortodoxo,finanzas,Journal of Finance
2010-17,17,"Garman, M. B., and Kohlhagen, S. W. (1983). Foreign Currency Option Values. Journal of International Money and Finance, 2, 231-37. 22",1983,ortodoxo,internacional,Journal of International Money and Finance
2010-17,18,"Guarkaynak, R., Sack B., and Swanson E. (2005). The Sensitivity of Long-Term Interest Rates to Economic News: Evidence and Implications for Macroeconomic Models. American Economic Review, 95, 425-436.",2005,ortodoxo,tier1_generalist,American Economic Review
2010-17,19,"Hamilton, J. D. (2009). Daily Changes in Fed Funds Futures Prices. Journal of Money, Credit and Banking, 41, No. 4.",2009,ortodoxo,macro_monetario,"Journal of Money, Credit and Banking"
2010-17,20,"Jackwerth, J. C. (2004). Option-Implied Risk-Neutral Distributions and Risk Aversion. Charlotteville: Research Foundation of AIMR.",2004,desconocido,desconocido,
2010-17,21,"Jones, C., Lamont O., and Lumsdaine R. (1998). Macroeconomic News and Bond Market Volatility. Journal of Financial Economics, 47, 315-337.",1998,ortodoxo,finanzas,Journal of Financial Economics
2010-17,22,"Kuttner, K. N. (2001). Monetary Policy Surprises and Interest Rates: Evidence from the Fed Funds Futures Market. Journal of Monetary Economics, 47, 523-44.",2001,ortodoxo,macro_monetario,Journal of Monetary Economics
2010-17,23,"Malz, A. M. (1997). Estimating the Probability Distribution of the Future Exchange Rate from Option Prices. Journal of Derivatives, 5, 18-36. McManus, D. J. (1999). The Information Content of Interest Rate Futures Options. Bank of Canada. Working Paper No. 99-15. McNeil, A. J., Frey, R. and Embrechts, P. (2005) Quantitative Risk Management. Concepts Techniques Tools. Princeton Series in Finance.",1997,institucional,wp_bc_avanzado,Bank of Canada
2010-17,24,"Melick, W. and Thomas C. (1997). Recovering an Asset’s Implied PDF from Option Prices: an Application to Crude Oil During the Gulf Crisis. Journal of Financial and Quantitative Analysis, 32, 91-115.",1997,desconocido,desconocido,
2010-17,25,"Micu, M. (2004). Extracting Expectations from Currency Option Prices: A Comparison of Methods. Bank of International Settlements. Working Paper. September.",2004,institucional,wp_multilateral,BIS Working Paper
2010-17,26,"Newey, W. K., and West K. D. (1987). A Simple, Positive Semi-Definite, Heteroskedasticity and Autocorrelation Consistent Covariance Matrix. Econometrica, 55, 703-70. 23",1987,ortodoxo,tier1_generalist,Econometrica
2010-17,27,"Rangel, J.G. (2009). Macroeconomic News, Announcements, and Stock Market Jump Intensity Dynamics. Journal of Banking and Finance. Forthcoming.",2009,ortodoxo,finanzas,Journal of Banking and Finance
2010-17,28,"Rubinstein, M. (1994). Implied Binomial Trees. Journal of Finance, 49, 771-818. Shimko D., (1993). Bounds of probability. Risk Magazine, 6, 33-37.",1994,ortodoxo,finanzas,Journal of Finance
2010-17,29,"Soderlind, P. (2000). Market Expectations in the UK Before and after the ERM Crisis. Economica, 67.",2000,ortodoxo,otros_mainstream,Economica
2010-17,30,"Taylor, S. J. (2005). Asset Price Dynamics, Volatility, and Prediction. Princeton University Press. 24 Table 1 Monetary policy interest rate announcements by Banco de Mexico and the Federal Reserve System. Banco de Mexico Federal Reserve System Date Announcement Basis points Date Announcement Basis points September 23, 2005 Interest rate decrease 25 September 20, 2005 Interest rate increase 25 Oct",2005,institucional,wp_banxico,Banco de México WP
2010-12,1,"Benavides, G. (2006). Volatility Forecasts for the Mexican Peso – U.S. Dollar Exchange Rate: An Empirical Analysis of GARCH, Option Implied and Composite Forecast Models. Documento de investigación No. 2006-04. Banco de México. DGIE. Mexico.",2006,institucional,wp_banxico,Banco de México WP
2010-12,2,"Benavides, G. (2009). Price Volatility Forecasts for Agricultural Commodities: An Application of Historical Volatility Models, Option Implieds and Composite Approaches for Futures Prices of Corn and Wheat. Journal of Management, Finance and Economics. Vol.",2009,desconocido,desconocido,
2010-12,3,"Benavides, G. and Snowden P. N. (2006). Futures for Farmers: Hedging Participation and the Mexican Corn Scheme. Journal of Development Studies. Vol. 42. No. 4. pp. 698 –",2006,desconocido,desconocido,
2010-12,4,"Bollerslev, T. P. (1986). Generalized Autoregressive Conditional Heteroscedasticity. Journal of Econometrics. Vol. 31. (307-327).",1986,ortodoxo,econometria,Journal of Econometrics
2010-12,5,"Bollerslev, T. P., Chou, R. Y. and Kroner, K. F. (1992). ARCH Modeling in Finance: A Review of the Theory and Empirical Evidence. Journal of Econometrics 52 (5-59).",1992,ortodoxo,econometria,Journal of Econometrics
2010-12,6,"Bollerslev, T. and Wooldridge, J. M. (1992) “Quasi-Maximum Likelihood Estimation and Inference in Dynamic Models with Time Varying Covariances,” Econometric Reviews, 11, 143–172.",1992,ortodoxo,econometria,Econometric Reviews
2010-12,7,"Brock, W., Dechert, D., Sheinkman, J and LeBaron, B. (1996). A Test for Independence Based on the Correlation Dimension. Econometric Reviews. August, 15 Vol. 3. pp. 197- 235.",1996,ortodoxo,econometria,Econometric Reviews
