clave_paper,num_ref,texto_raw,anio_citado,categoria,subcategoria,journal_detectado
2018-22,24,"Kim, D. H. and Wright, J. H. (2005) An Arbitrage-Free Three-Factor Term Structure Model and the Recent Behavior of Long-Term Yields and Distant-Horizon Forward Rates, Fi- nance and Economics Discussion Series 2005-33, Board of Governors of the Federal Re- serveSystem(U.S.).",2005,desconocido,desconocido,
2018-22,25,"King, M. and Low, D. (2014) Measuring the ”World” Real Interest Rate, NBER Working Papers19887,NationalBureauofEconomicResearch,Inc.",2014,institucional,wp_multilateral,NBER Working Paper
2018-22,26,"Kocherlakota, N. R. (2015) Fiscal Policy and the Long-Run Neutral Real Interest Rate, Speech135,FederalReserveBankofMinneapolis.",2015,institucional,wp_bc_avanzado,Federal Reserve
2018-22,27,"Krippner, L. (2015) Measures of the Stance of United States Monetary Policy, Tech. rep., ReserveBankofNewZealand.",2015,institucional,wp_bc_avanzado,Reserve Bank
2018-22,28,"Lama, R. (2011) Accounting for Output Drops in Latin America, Review of Economic Dy- namics,14,295–316.",2011,desconocido,desconocido,
2018-22,29,"Laubach, T. and Williams, J. C. (2003) Measuring the Natural Rate of Interest, The Review ofEconomicsandStatistics,85,1063–1070.",2003,ortodoxo,econometria,Review of Economics and Statistics
2018-22,30,"Laubach,T.andWilliams,J.C.(2016)MeasuringtheNaturalRateofInterestRedux,Finance and Economics Discussion Series 2016-11, Board of Governors of the Federal Reserve System(U.S.).",2016,institucional,wp_bc_avanzado,Federal Reserve
2018-22,31,"Lombardi, M. and Zhu, F. (2014) A Shadow Policy Rate to Calibrate US Monetary Policy at theZeroLowerBound,BISWorkingPapers452,BankforInternationalSettlements. 43",2014,institucional,wp_multilateral,BIS Working Paper
2018-22,32,"Lubik, T. A. and Matthes, C. (2015) Calculating the Natural Rate of Interest: A Comparison ofTwoAlternativeApproaches,RichmondFedEconomicBrief,pp.1–6.",2015,desconocido,desconocido,
2018-22,33,"Magud, N. E. and Tsounta, E. (2012) To Cut or Not to Cut? That is the (Central Bank’s) Question In Search of the Neutral Interest Rate in Latin America, IMF Working Papers 12/243,InternationalMonetaryFund. Melo-Velandia, L. F. and Granados-Castro, J. C. (2010) Expectativas y Prima por Riesgo Inflacionario bajo una Medida de Compensacio´n a la Inflacio´n, Borradores de Economia 589,BancodelaRepubli",2012,institucional,wp_multilateral,IMF Working Paper
2018-22,34,"Mesonnier, J.-S. and Renne, J.-P. (2007) A Time-Varying Natural Rate of Interest for the EuroArea,EuropeanEconomicReview,51,1768–1784.",2007,ortodoxo,otros_mainstream,European Economic Review
2018-22,35,"Perrelli,R.andRoache,S.K.(2014)Time-VaryingNeutralInterestRate: TheCaseofBrazil, IMFWorkingPapers14/84,InternationalMonetaryFund.",2014,institucional,wp_multilateral,IMF Working Paper
2018-22,36,"Pescatori, A. and Turunen, J. (2015) Lower for Longer: Neutral Rates in the United States, IMFWorkingPaper15/135,InternationalMonetaryFund.",2015,institucional,wp_multilateral,IMF Working Paper
2018-22,37,"Primiceri,G.E.(2005)TimeVaryingStructuralVectorAutoregressionsandMonetaryPolicy, TheReviewofEconomicStudies,72,821.",2005,ortodoxo,tier1_generalist,Review of Economic Studies
2018-22,38,"Rachel, L. and Smith, T. D. (2015) Secular Drivers of the Global Real Interest Rate, Staff WorkingPaper571,BankofEngland. Ram´ırez, C. and Gonza´lez, M. (2017) Have QE Programs Affected Capital Flows to Emerg- ing Markets?: A Regional Analysis, in International Spillovers of Monetary Policy (Eds.) A.Estrada-Garc´ıaandA.Ortiz-Bolan˜os,CenterforLatinAmericanMonetaryStudiesand BancodeEspan˜a,pp.155–1",2015,institucional,wp_bc_avanzado,Bank of England
2018-22,39,"Richardson, A. and Williams, R. (2015) Estimating New Zealand’s Neutral Interest Rate, ReserveBankofNewZealandAnalyticalNotesseriesAN2015/05,ReserveBankofNew Zealand. 44 Schmidt-Hebbel, K. and Walsh, C. E. (2009) Monetary Policy and Key Unobservables: Evi- dencefromLargeIndustrialandSelectedInflation-TargetingCountries,inMonetaryPolicy under Uncertainty and Learning (Eds.) K. Schmidt-Hebbel, C. E.",2015,ortodoxo,internacional,Journal of International Economics
2018-22,40,"Taylor, J. B. and Wieland, V. (2016) Finding the Equilibrium Real Interest Rate in a Fog of Policy Deviations, Economics Working Papers 16109, Hoover Institution, Stanford Uni- versity.",2016,desconocido,desconocido,
2018-22,41,"Tillmann, P. (2016) Unconventional Monetary Policy and the Spillovers to Emerging Mar- kets,JournalofInternationalMoneyandFinance,66,136–156.",2016,ortodoxo,internacional,Journal of International Money and Finance
2018-22,42,"Winter, C. (2017) The Impact of Government Debt on the Long-Run Natural Real Interest Rate-aQuantitativeEvaluation,AppliedEconomicsLetters,24,1429–1434. Wu,J.C.andXia,F.D.(2016)MeasuringtheMacroeconomicImpactofMonetaryPolicyat theZeroLowerBound,JournalofMoney,CreditandBanking,48,253–291.",2017,ortodoxo,macro_monetario,"Journal of Money, Credit and Banking"
2018-22,43,"Yellen, J. L. (2015) The Outlook for the Economy: A Speech at The Economics Club of",2015,desconocido,desconocido,
2018-22,44,"Washington, Washington, D.C., December 2, 2015, Speech 851, Board of Governors of theFederalReserveSystem(U.S.).",2015,institucional,wp_bc_avanzado,Federal Reserve
2018-19,1,"Albrecht, J., Navarro, L., and Vroman, S. (2009). The Effects of Labour Market Policies in anEconomywithanInformalSector. EconomicJournal,119(539):1105–1129.",2009,ortodoxo,otros_mainstream,Economic Journal
2018-19,2,"Alcaraz, C., Chiquiar, D., and Ramos-Francia, M. (2011). Wage Differentials in Mexico’s UrbanLaborMarket. EconomicsBulletin,31(3):2500–2508.",2011,desconocido,desconocido,
2018-19,3,"Alcaraz, C., Chiquiar, D., and Salcedo, A. (2015). Informality and Segmentation in the MexicanLaborMarket. BancodeMéxico,DocumentodeInvestigación,2015-25. Alonso-Ortiz, J. and Leal, J. (2017). Cross-Subsidies, and the Elasticity of Informality to SocialExpenditures: TheCaseofMexico’sSeguroPopular. ReviewofIncomeandWealth.",2015,institucional,wp_banxico,Banco de México WP
2018-19,4,"Amaral,P.S.andQuintin,E.(2006). Acompetitivemodeloftheinformalsector. Journalof MonetaryEconomics,53(7):1541–1553.",2006,ortodoxo,macro_monetario,Journal of Monetary Economics
2018-19,5,"Andolfatto, D. (1996). Business Cycles and Labor-Market Search. American Economic Review,86(1):112–132.",1996,ortodoxo,tier1_generalist,American Economic Review
2018-19,6,"Blanchard, O. and Diamond, P. (1990). The Aggregate Matching Function. In Growth, ProductivityandUnemployment,pages159–201.",1990,desconocido,desconocido,
2018-19,7,"Blanchard,O.andKahn,C.(1980).TheSolutionofLinearDifferenceModelsunderRational Expectations. Econometrica,48(5):1305–1311.",1980,ortodoxo,tier1_generalist,Econometrica
2018-19,8,"Bosch, M. and Esteban-Pretel, J. (2012). Job creation and job destruction in the presence of informalmarkets. JournalofDevelopmentEconomics,98(2):270–286. 32",2012,ortodoxo,otros_mainstream,Journal of Development Economics
2018-19,9,"Bosch, M. and Maloney,W. (2008). Cyclical Movementsin Unemployment and Informality inDevelopingCountries. TheWorldBank,PolicyResearchWorkingPaper,4648.",2008,institucional,wp_multilateral,World Bank
2018-19,10,"Bosch, M. and Manacorda, M. (2010). Minimum Wages and Earnings Inequality in Urban Mexico. AmericanEconomicJournal: AppliedEconomics,2(4):128–149.",2010,ortodoxo,otros_mainstream,Economic Journal
2018-19,11,"Boz,E.,Durdu,B.,andLi,N.(2015). EmergingMarketBusinessCycles: TheRoleofLabor MarketFrictions. JournalofMoney,CreditandBanking,47(1):31–72.",2015,ortodoxo,macro_monetario,"Journal of Money, Credit and Banking"
2018-19,12,"Conesa,J.C.,Díaz-Moreno,C.,andGaldón-Sánchez,J.E.(2002). Explainingcross-country differencesinparticipationratesandaggregatefluctuations. JournalofEconomicDynam- icsandControl,26(2):333–345. DeLoach, S. B. and Kurt, M. (2013). Discouraging Workers: Estimating the Impacts of Macroeconomic Shocks on the Search Intensity of the Unemployed. Journal of Labor Research,34(4):433–454. D’Erasmo, P. N. and ",2002,ortodoxo,macro_monetario,Journal of Monetary Economics
2018-19,13,"Fernández, A. and Meza, F. (2015). Informal employment and business cycles in emerging economies: ThecaseofMexico. ReviewofEconomicDynamics,18(2):381–405. Finkelstein Shapiro, A. (2014). Self-employment and business cycle persistence: Does the composition of employment matter for economic recoveries? Journal of Economic Dy- namicsandControl,46:200–218.",2015,desconocido,desconocido,
2018-19,14,"Gomme, P. and Lkhagvasuren, D. (2015). Worker Search Effort as an Amplification Mecha- nism. JournalofMonetaryEconomics,75:106–122.",2015,ortodoxo,macro_monetario,Journal of Monetary Economics
2018-19,15,"Hall, R. E. (2017). High Discounts and High Unemployment. American Economic Review, 107(2):305–330.",2017,ortodoxo,tier1_generalist,American Economic Review
2018-19,16,"Heckman, J. and Pagés-Serra, C. (2000). The Cost of Job Security Regulation: Evidence fromLatinAmericanLaborMarkets. Economía,1(1):109–144. 33",2000,desconocido,desconocido,
2018-19,17,"Horvath, J. (2018). Business cycles, informal economy, and interest rates in emerging coun- tries. JournalofMacroeconomics,55:96–116. INEGI (2015). Sistema de Cuentas Nacionales de México: Medición de la Economía Infor- mal.",2018,ortodoxo,macro_monetario,Journal of Macroeconomics
2018-19,18,"Krusell, P., Mukoyama, T., Rogerson, R., and S¸ahin, A. (2017). Gross Worker Flows over theBusinessCycle. AmericanEconomicReview,107(11):3447–3476.",2017,ortodoxo,tier1_generalist,American Economic Review
2018-19,19,"Lama, R. and Urrutia, C. (2011). Employment Protection and Business Cycles in Emerging Economies. InternationalMonetaryFundWorkingPaper,11/293.",2011,institucional,wp_multilateral,IMF Working Paper
2018-19,20,"Leal, J. (2014). Tax collection, the informal sector, and productivity. Review of Economic Dynamics,17(2):262–286.",2014,desconocido,desconocido,
2018-19,21,"Levy, S. and Székely, M. (2016). Más escolaridad, menos informalidad? Un análisis de cohortesparaMéxicoyAméricaLatina. ElTrimestreEconómico,LXXXIII(4):499–548.",2016,ortodoxo,otros_mainstream,El Trimestre Económico
2018-19,22,"Leyva, G. (2018). Against All Odds: Job Search During the Great Recession. Banco de",2018,desconocido,desconocido,
2018-19,23,"México,DocumentodeInvestigación,2018-13. Lopez-Martin, B. (2016). Informal Sector Misallocation. Banco de México, Documento de Investigación,2016-09.",2018,institucional,wp_banxico,Banco de México WP
2018-19,24,"Merz,M.(1995). Searchinthelabormarketandtherealbusinesscycle. JournalofMonetary Economics,36(2):269–300.",1995,ortodoxo,macro_monetario,Journal of Monetary Economics
2018-19,25,"Mortensen, D. and Pissarides, C. (1994). Job Creation and Job Destruction in the Theory of Unemployment. ReviewofEconomicStudies,61(3):397–415.",1994,ortodoxo,tier1_generalist,Review of Economic Studies
2018-19,26,"Mukoyama, T., Patterson, C., and S¸ahin, A. (2018). Job Search Behavior over the Business Cycle. AmericanEconomicJournal: Macroeconomics,10(1):190–215.",2018,ortodoxo,macro_monetario,AEJ: Macroeconomics
2018-19,27,"Neumeyer,P.andPerri,F.(2005).Businesscyclesinemergingeconomies: theroleofinterest rates. JournalofMonetaryEconomics,52(2):345–380. 34 Restrepo-Echavarria,P.(2014).Macroeconomicvolatility: Theroleoftheinformaleconomy. EuropeanEconomicReview,70:454–469. Schmitt-Grohé, S. and Uribe, M. (2003). Closing small open economy models. Journal of InternationalEconomics,61(1):163–185. Schmitt-Grohé,S.andUribe",2005,ortodoxo,macro_monetario,Journal of Monetary Economics
2018-19,28,"Schneider,F.(2007).ShadowEconomiesandCorruptionAllOvertheWorld: NewEstimates for145Countries. Economics,2007-9.",2007,desconocido,desconocido,
2018-19,29,"Shimer,R.(2004). SearchIntensity. WorkingPaper,UniversityofChicago.",2004,desconocido,desconocido,
2018-19,30,"Shimer, R. (2012). Reassessing the ins and outs of unemployment. Review of Economic Dynamics,15(2):127–148. 35",2012,desconocido,desconocido,
2018-18,1,"ALBAGLI, E., A. NAUDON, AND R. VERGARA(2015): “InflationDynamicsinLATAM: A Comparison with Global Trends and Implications for Monetary Policy,” Economic PolicyPapersCentralBankofChile58,CentralBankofChile. BAQUEIRO, A., A. DÍAZ DE LEÓN, AND A. TORRES-GARCÍA (2003): “Temor a la flotación o a la inflación? La importancia del “traspaso” del tipo de cambio a los pre- cios,”WorkingPapers2003-02,Bancode",2015,ortodoxo,tier1_generalist,American Economic Review
2018-16,1,"11 Relatedly, some of the central banks that publish fan charts generally do so under one of two possible assumptions. A fan chart conditional on the monetary policy expected by the market, and a fan chart conditional on the monetary policy expected by monetary authority. 21 [9.] Diebold, F. X. and R. S. Mariano (1995). “Comparing Predictive Accuracy”. Journal of Bussiness & Economic Statistics, 2",1995,ortodoxo,tier1_generalist,American Economic Review
2018-13,1,"Aguiar, M., E. Hurst, and L. Karabarbounis (2013a): “The Life-Cycle Profile of Time Spent on Job Search,” American Economic Review, 103(3), 111–16. 12 ——— (2013b): “Time Use during the Great Recession,” American Economic Review, 103(5), 1664–96. 1, 2, 6, 16, 17, 20, 23",,ortodoxo,tier1_generalist,American Economic Review
2018-13,2,"Andolfatto, D. (1996): “Business Cycles and Labor-Market Search,” American Economic Review, 86(1), 112–32. 27, 28",1996,ortodoxo,tier1_generalist,American Economic Review
2018-13,3,"Barnichon, R. (2010): “Building a composite Help-Wanted Index,” Economics Letters, 109(3), 175–178. 44",2010,ortodoxo,otros_mainstream,Economics Letters
2018-13,4,"Bowler, M., R. Ilg, S. Miller, E. Robison, and A. Polivka (2003): “Re- visions to the Current Population Survey Effective in January 2003,” CPS Technical Documentation, Bureau of Labor Statistics, available in https: //www.bls.gov/cps/rvcps03.pdf. 15 Chodorow-Reich, G. and L. Karabarbounis (2016): “The Cyclicality of the Opportunity Cost of Employment,” Journal of Political Economy, 124(6), 1563–1",2003,ortodoxo,tier1_generalist,Journal of Political Economy
2018-13,5,"Clark, K. B. and L. H. Summers (1982): “Labour Force Participation: Timing and Persistence,” Review of Economic Studies, 49(5), 825–44. 48",1982,ortodoxo,tier1_generalist,Review of Economic Studies
2018-13,6,"Davis, S. J. and T. von Wachter (2011): “Recessions and the Costs of Job Loss,” Brookings Papers on Economic Activity, 43, 1–72. 46, 47, 49 DeLoach, S. and M. Kurt (2013): “Discouraging Workers: Estimating the Impacts of Macroeconomic Shocks on the Search Intensity of the Unemployed,” Journal of Labor Research, 34(4), 433–454. 1, 16, 23, 25, 26 den Haan, W. J., G. Ramey, and J. Watson (2000): “Job",2011,ortodoxo,tier1_generalist,American Economic Review
2018-13,7,"Frazis, H. and J. Stewart (2012): “How to Think about Time-Use Data: What Inferences Can We Make about Long- and Short-Run Time Use from Time Diaries?” Annals of Economics and Statistics, 231–245. 6",2012,desconocido,desconocido,
2018-13,8,"Gelman, A. and J. Hill (2007): Data Analysis Using Regressions and Multi- level/Hierarchical Models, Cambridge University Press. 19",2007,ortodoxo,libro_mainstream,Libro (Cambridge University Press)
2018-13,9,"Gomme, P. and D. Lkhagvasuren (2015): “Worker search effort as an ampli- fication mechanism,” Journal of Monetary Economics, 75, 106–122. 1, 10, 16, 23, 25, 26",2015,ortodoxo,macro_monetario,Journal of Monetary Economics
2018-13,10,"Hagedorn, M. and I. Manovskii (2008): “The Cyclical Behavior of Equilib- rium Unemployment and Vacancies Revisited,” American Economic Review, 98(4), 1692–1706. 43",2008,ortodoxo,tier1_generalist,American Economic Review
2018-13,11,"Hall, R. E. (1997): “Macroeconomic Fluctuations and the Allocation of Time,” Journal of Labor Economics, 15(1), S223–50. 1",1997,ortodoxo,otros_mainstream,Journal of Labor Economics
2018-13,12,"Hopenhayn, H. A. and E. C. Prescott (1992): “Stochastic Monotonicity and Stationary Distributions for Dynamic Economies,” Econometrica, 60(6), 1387–406. 68",1992,ortodoxo,tier1_generalist,Econometrica
2018-13,13,"Kambourov, G. and I. Manovskii (2008): “Rising Occupational And Indus- try Mobility In The United States: 1968-97,” International Economic Review, 49(1), 41–79. 15",2008,desconocido,desconocido,
2018-13,14,"Kroft, K. and M. J. Notowidigdo (2016): “Should Unemployment Insur- ance Vary With the Unemployment Rate? Theory and Evidence,” Review of Economic Studies, 83(3), 1092–1124. 49",2016,ortodoxo,tier1_generalist,Review of Economic Studies
2018-13,15,"Lucas, R., N. Stokey, and E. C. Prescott (1989): Recursive Methods in Economic Dynamics, Harvad University Press. 64, 65",1989,desconocido,desconocido,
2018-13,16,"Mankiw, N. G. (1989): “Real Business Cycles: A New Keynesian Perspective,” Journal of Economic Perspectives, 3(3), 79–90. 48 51",1989,ortodoxo,otros_mainstream,Journal of Economic Perspectives
2018-13,17,"Merz, M.(1995): “Searchinthelabormarketandtherealbusinesscycle,” Journal of Monetary Economics, 36(2), 269–300. 27, 28, 34",1995,ortodoxo,macro_monetario,Journal of Monetary Economics
2018-13,18,"Mitman, K. and S. Rabinovich (2015): “Optimal unemployment insurance in an equilibrium business-cycle model,” Journal of Monetary Economics, 71, 99–118. 49",2015,ortodoxo,macro_monetario,Journal of Monetary Economics
2018-13,19,"Mortensen, D. T. and C. A. Pissarides (1994): “Job Creation and Job De- struction in the Theory of Unemployment,” Review of Economic Studies, 61(3), 397–415. 3, 26, 28",1994,ortodoxo,tier1_generalist,Review of Economic Studies
2018-13,20,"Mukoyama, T., C. Patterson, and A. Şahin (2013): “Job Search Behavior overtheBusinessCycle,” Workingpaper,PresentedintheSymposiumonLabor Markets Frictions and the Business Cycle, at HEC Montréal, Institute of Ap- plied Economics, available in http://www.hec.ca/en/iea/chairs_centres_ groups/macromontreal/mukoyama.pdf. 37, 69 ———(2018): “JobSearchBehaviorovertheBusinessCycle,” American Economic Jour",2013,ortodoxo,macro_monetario,AEJ: Macroeconomics
2018-13,21,"Pissarides, C. A. (2000): Equilibrium Unemployment Theory, 2nd Edition, MIT Press Books, The MIT Press. 28, 41",2000,ortodoxo,libro_mainstream,Libro (Mit Press)
2018-13,22,"Polivka, A. and J. Rothgeb (1993): “Redesigning the CPS questionnaire,” Monthly Labor Review, September, 10–28. 9",1993,desconocido,desconocido,
2018-13,23,"Shimer, R. (2004): “Search Intensity,” Working paper, University of Chicago. 1, 3, 9, 10, 11, 12, 16, 17, 22, 23, 28, 35, 38 ——— (2005): “The Cyclical Behavior of Equilibrium Unemployment and Vacan- cies,” American Economic Review, 95(1), 25–49. 2, 3, 35, 38 ——— (2008): “The Probability of Finding a Job,” American Economic Review, 98(2), 268–273. 15 ——— (2012): “Reassessing the Ins and Outs of Une",2004,ortodoxo,tier1_generalist,American Economic Review
2018-13,24,"Stewart, J. (2013): “Tobit or not Tobit?” Journal of Economic and Social Measurement, 263–290. 6, 19",2013,ortodoxo,otros_mainstream,Economica
2018-13,25,"Topkis, D. M. (1998): Supermodularity and Complementarity, Princeton Univer- sity Press. 67 U.S. Bureau of Labor Statistics (2016): “American Time Use Survey User’s Guide,” User’s Guide, BLS, available in http://www.bls.gov/tus/ atususersguide.pdf. 13, 14, 62 U.S. Census Bureau(2013): “CurrentPopulationSurveyInterviewingManual,” CPS Technical Documentation, U.S. Census Bureau, available in http://",1998,desconocido,desconocido,
2018-09,1,"Aastveit, K. A., Bjørnland, H. C., Thorsrud, L. A., 2015. What Drives Oil Prices? Emerging VersusDevelopedEconomies.JournalofAppliedEconometrics30(7),1013–1028. URLhttp://dx.doi.org/10.1002/jae.2406",2015,ortodoxo,econometria,Journal of Applied Econometrics
2018-09,2,"Abeysinghe, T., 2001. Estimation of direct and indirect impact of oil price on growth. Economics Letters73(2),147–153. URLhttp://www.sciencedirect.com/science/article/pii/S0165176501004761",2001,ortodoxo,otros_mainstream,Economics Letters
2018-09,3,"Barsky, R., Kilian, L., 2002. Do We Really Know that Oil Caused the Great Stagflation? A Mon- etaryAlternative.NBERMacroeconomicsAnnual2001.",2002,institucional,wp_multilateral,NBER Macroeconomics Annual
2018-09,4,"Barsky, R., Kilian, L., 2004. Oil and the macroeconomy since the 1970s. Journal of Economic Perspectives(18),115–134.",2004,ortodoxo,otros_mainstream,Journal of Economic Perspectives
2018-09,5,"Bernanke, B., Gertler, M., Watson, M., 1997. Systematic Monetary Policy and the Effects of Oil Shocks.BrookingsPapersonEconomicActivity(1997-1). 11",1997,ortodoxo,macro_monetario,Brookings Papers on Economic Activity
2018-09,6,"Blanchard, O. J., Gali, J., September 2007. The Macroeconomic Effects of Oil Shocks: Why are the2000ssodifferentfromthe1970s?(13368). URLhttp://www.nber.org/papers/w13368",2007,desconocido,desconocido,
2018-09,7,"Cologni, A., Manera, M., May 2008. Oil prices, inflation and interest rates in a structural cointe- gratedVARmodelfortheG-7countries.EnergyEconomics30(3),856–888. URLhttps://ideas.repec.org/a/eee/eneeco/v30y2008i3p856-888.html",2008,desconocido,desconocido,
2018-09,8,"Cuñado, J., Jo, S., Pérez de Gracia, F., 2015. Macroeconomic impacts of oil price shocks in asian economies.EnergyPolicy86(C),867–879. URL http://EconPapers.repec.org/RePEc:eee:enepol:v:86:y:2015:i:c:p: 867-879",2015,desconocido,desconocido,
2018-09,9,"Cuñado, J., Pérez de Gracia, F., 2005. Oil prices, economic activity and inflation: evidence for someAsiancountries.TheQuarterlyReviewofEconomicsandFinance45(1),65–83. URLhttp://EconPapers.repec.org/RePEc:eee:quaeco:v:45:y:2005:i:1:p:65-83",2005,ortodoxo,otros_mainstream,Economica
2018-09,10,"Hamilton, J. D., April 1983. Oil and the Macroeconomy since World War II. Journal of Political Economy91(2),228–248. URLhttps://ideas.repec.org/a/ucp/jpolec/v91y1983i2p228-48.html Hamilton,J.D.,October1996.Thisiswhathappenedtotheoilprice-macroeconomyrelationship. JournalofMonetaryEconomics38(2),215–220. URLhttps://ideas.repec.org/a/eee/moneco/v38y1996i2p215-220.html",1983,ortodoxo,tier1_generalist,Journal of Political Economy
2018-09,11,"Hamilton,J.D.,2003.WhatIsanOilShock? JournalofEconometrics113(2),363–398.",2003,ortodoxo,econometria,Journal of Econometrics
2018-09,12,"Hamilton, J. D., 2008. oil and the macroeconomy. In: Durlauf, S. N., Blume, L. E. (Eds.), The NewPalgraveDictionaryofEconomics.PalgraveMacmillan,Basingstoke.",2008,desconocido,desconocido,
2018-09,13,"Hamilton, J. D., Herrera, A. M., 2004. Comment: Oil Shocks and Aggregate Macroeconomic Behavior: The Role of Monetary Policy. Journal of Money, Credit, and Banking 36 (2), 265– 286.",2004,ortodoxo,macro_monetario,"Journal of Money, Credit and Banking"
2018-09,14,"Herrera, A. M., Lagalo, L. G., Wada, T., 2015. Asymmetries in the response of economic activity tooilpriceincreasesanddecreases? JournalofInternationalMoneyandFinance50,108–133. URLhttp://www.sciencedirect.com/science/article/pii/S0261560614001399 Hooker,M.A.,October1996.Whathappenedtotheoilprice-macroeconomyrelationship? Journal ofMonetaryEconomics38(2),195–213. URLhttps://ideas.repec.org/a/eee/m",2015,ortodoxo,macro_monetario,Journal of Monetary Economics
2018-09,15,"Kilian, L., June 2009. Not All Oil Price Shocks Are Alike: Disentangling Demand and Supply shocksinthecrudeoilmarket.AmericanEconomicReview99(3),1053–69.",2009,ortodoxo,tier1_generalist,American Economic Review
2018-09,16,"Kilian, L., Rebucci, A., Spatafora, N., 2009. Oil shocks and external balances. Journal of Interna- tionalEconomics77(2),181–194.",2009,desconocido,desconocido,
2018-09,17,"Kilian,L.,Vigfusson,R.,2011.AretheresponsesoftheU.S.economyasymmetricinenergyprice increasesanddecreases? QuantitativeEconomics2(3),419–453. URLhttp://EconPapers.repec.org/RePEc:ecm:quante:v:2:y:2011:i:3:p:419-453",2011,desconocido,desconocido,
2018-09,18,"Lee, K., Ni, S., Ratti, R. A., 1995. Oil shoks and the macroeconomy: the role of price variability. EnergyJournal16,39–56.",1995,desconocido,desconocido,
2018-09,19,"Mork, K. A., 1989. Oil and the macroeconomy when prices go up and down: An extension of hamilton’sresults.JournalofPoliticalEconomy91,740–744.",1989,ortodoxo,tier1_generalist,Journal of Political Economy
2018-09,20,"Peersman,G.,VanRobays,I.,2012.Cross-countrydifferencesintheeffectsofoilshocks.Energy Economics34(5),1532–1547. URL http://EconPapers.repec.org/RePEc:eee:eneeco:v:34:y:2012:i:5:p: 1532-1547",2012,desconocido,desconocido,
2018-09,21,"Pesaran, M. H., Smith, R., July 1995. Estimating long-run relationships from dynamic heteroge- neouspanels.JournalofEconometrics68(1),79–113.",1995,ortodoxo,econometria,Journal of Econometrics
2018-09,22,"Segal, P., 2011. Oil price shocks and the macroeconomy. Oxford Review of Economic Policy 27(1),169–185. URLhttp://oxrep.oxfordjournals.org/content/27/1/169.abstract",2011,ortodoxo,otros_mainstream,Economic Policy
2018-09,23,"Uhlig, H., March 2005. What are the effects of monetary policy on output? Results from an agnosticidentificationprocedure.JournalofMonetaryEconomics52(2),381–419. URLhttps://ideas.repec.org/a/eee/moneco/v52y2005i2p381-419.html 13",2005,ortodoxo,macro_monetario,Journal of Monetary Economics
2018-09,24,"1. All Canada,France,Germany,Italy,Japan,Norway,Spain,UK,US, Brazil,Chile,CzechRep.,Ireland,Israel,Mexico,Poland,Russia",,desconocido,desconocido,
2018-09,25,"2. AE Canada,France,Germany,Italy,Japan,Norway,Spain,UK,US",,desconocido,desconocido,
