clave_paper,num_ref,texto_raw,anio_citado,categoria,subcategoria,journal_detectado
2024-10,20,"Nakamura, E. and J. Steinsson (2008). Five facts about prices: A reevaluation of menu cost models. The Quarterly Journal of Economics 123(4), 1415–1464.",2008,ortodoxo,tier1_generalist,Quarterly Journal of Economics
2024-10,21,"Nakamura, E. and J. Steinsson (2013). Price rigidity: Microeconomic evidence and macroe- conomic implications. Annual Review of Economics 5(1), 133–163. 36 Solórzano, D. (2023a). Grab a bite? Prices in the food away from home industry during the COVID-19 pandemic. In Documentos de Investigación 2023-18. Banco de México. Solórzano, D. (2023b). Stylized facts from prices at multi-channel retailers i",2013,institucional,wp_banxico,Banco de México WP
2024-10,22,"Taylor, J. B. (1980). Aggregate dynamics and staggered contracts. Journal of Political Economy 88(1), 1–23.",1980,ortodoxo,tier1_generalist,Journal of Political Economy
2024-10,23,"Wooldridge, J. M. (2010). Econometric analysis of cross section and panel data. MIT. 37",2010,ortodoxo,tier1_generalist,Econometrica
2024-10,24,"6 Appendix - Summary Statistics Figure 10: Type of Price Spells (a) Observations by Type of Spell 400,000 300,000 200,000 100,000 0 6102naj10 7102naj10 8102naj10 9102naj10 0202naj10 1202naj10 2202naj10 (b)FractionofCompleteSpellsbyDurationinDays 0.14 Complete IRC RC 0.12 IRC ILC IRC LC 0.10 RC ILC ILC 0.08 LC 0.06 0.04 0.02 0.00 0 41 82 24 65 07 48 89 211 621 041 451 861 281 691 012 422 832 252 66",2016,institucional,wp_banxico,Banco de México WP
2024-10,25,"2. Data from January 1st 2016 to June 30th 2022. Source: Own calculations based on online data compiled by Banco de México. 40 Figure 13: Fraction of Complete, RC and IRC Spells by Duration in Days Capped at 182 Days (a) Food 0.18 0.16 0.14 0.12 0.10 0.08 0.06 0.04 0.02 0.00 0 7 41 12 82 53 24 94 65 36 07 77 48 19 89 501 211 911 621 331 041 741 451 161 861 571 281 (b) Apparel 0.18 0.16 0.14 0.12 0",2016,institucional,wp_banxico,Banco de México WP
2024-10,26,7 Appendix - Benchmark Model Figure 16: Hazard Ratios of Baseline Hazard in Days as Scatter Plot (a) All changes 1 (b) By Sign of Adjustment 1 0 7 14 21 28 35 42 49 56 63 70 77 84 91 Price Hikes Price Drops 0 7 14 21 28 35 42 49 56 63 70 77 84 91 Note: These panels complement Panel 4a and Panel 5a. Bear in mind that exponentiated coeﬀicients can be interpreted as hazardratiossincethecloglogmodelfr,2022,institucional,wp_banxico,Banco de México WP
2024-10,27,"8 Appendix - CPI Data Figure 20: CPI’s Type of Spells (a) All Retailers 60,000 40,000 20,000 0 (b) Similar Retailers 30,000 20,000 10,000 0 2016m12017m12018m12019m12020m12021m12022m1 Complete IRC and RC LC and others (c) Same Retailers 10,000 8,000 6,000 4,000 2,000 0 2016m12017m12018m12019m12020m12021m12022m1 Complete IRC and RC LC and others 2016m12017m12018m12019m12020m12021m12022m1 Complete IR",,desconocido,desconocido,
2024-10,28,"12 PersonalCare 35 9.44 72.35 8.01 2.70 8.08 2.56 5.08 0.67 0.55 0.00 Note: ThistablesummarizesallpricespellsthatcanbeconstructedintheCPIdataset. Importantly,CPIsamplesdependonthetyperetailersincluded: “Sameretailers”arethesameretailchainsastheonesencompassedinthewebscrapeddata,“Similarretailers”arethesupermarkets,departmentalstoresand priceclubssurveyedintheCPI,while“All”includeallpriceinformants",,desconocido,desconocido,
2024-10,29,"12 PersonalCare 25 10.55 3 1 1 1 2 4 7 11 56.61 43.37 Note: ThistablesummarizesthedurationdistributionofcompletepricespellsbyCOICOPDivision. Importantly,CPIsamplesdependonthetype retailersincluded:“Sameretailers”arethesameretailchainsastheonesencompassedinthewebscrapeddata,“Similarretailers”arethesupermarkets, departmentalstoresandpriceclubssurveyedintheCPI,while“All”includeallpriceinformantsinthe",,desconocido,desconocido,
2024-10,30,"12 PersonalCare 29 10.17 4 1 1 1 2 4 8 12 49.31 37.78 Note: ThistablesummarizesthedurationdistributionofpricespellsbyCOICOPDivision. Importantly, CPIsamplesdependonthetyperetailers includedintheestimationsample: “Sameretailers”arethesameretailchainsastheonesencompassedinthewebscrapeddata,“Similarretailers”are thesupermarkets,departmentalstoresandpriceclubssurveyedintheCPI,while“All”includeallprice",2016,desconocido,desconocido,
2023-21,1,"Algaba, A., Ardia, D., Bluteau, K., Borms, S., and Boudt, K. (2020). Econometrics meets sentiment: Anoverviewofmethodologyandapplications. JournalofEconomicSurveys, 34(3):512–547.",2020,ortodoxo,otros_mainstream,Journal of Economic Surveys
2023-21,2,"Anderes,M.,Rathke,A., Streicher,S.,andSturm, J.E.(2021). TheroleofECBcommunica- tioninguidingmarkets. PublicChoice,186(3):351–383.",2021,desconocido,desconocido,
2023-21,3,"Baranowski, P., Doryn´, W., Łyziak, T., and Stanisławska, E. (2021). Words and deeds in managingexpectations: Empiricalevidencefromaninflationtargetingeconomy. Economic Modelling,95:49–67.",2021,desconocido,desconocido,
2023-21,4,"Barro,R.J.(1976). Rationalexpectationsandtheroleofmonetarypolicy. JournalofMonetary Economics,2(1):1–32.",1976,ortodoxo,macro_monetario,Journal of Monetary Economics
2023-21,5,"Bholat,D., Hansen,S., Santos,P.,and Schonhardt-Bailey, C.(2015). Textmining forcentral banks. London: BankofEngland,CentreforCentralBankingStudies.",2015,institucional,wp_bc_avanzado,Bank of England
2023-21,6,"Blei,D.M.,Ng,A.Y.,andJordan,M.I.(2003). LatentDirichletallocation. TheJournalof MachineLearningResearch,3:993–1022.",2003,desconocido,desconocido,
2023-21,7,"Blinder,A.S.,Ehrmann,M.,Fratzscher,M.,DeHaan,J.,andJansen,D.J.(2008). Central bank communication and monetary policy: A survey of theory and evidence. Journal of EconomicLiterature,46(4):910–45.",2008,ortodoxo,otros_mainstream,Journal of Economic Literature
2023-21,8,"Capistrán,C.andLópez-Moctezuma,G.(2010). Macroeconomicexpectationsofprofessional forecasters: An evaluation of short-run forecasts in Mexico (in Spanish). El Trimestre Económico,77(306):275–312.",2010,ortodoxo,otros_mainstream,El Trimestre Económico
2023-21,9,"Capistrán,C.andLópez-Moctezuma, G.(2014). Forecastrevisionsof Mexican inflationand GDPgrowth. InternationalJournalofForecasting,30(2):177–191. 49 Coenen, G., Ehrmann, M., Gaballo, G., Hoffmann, P., Nakov, A., Nardelli, S., Persson, E., andStrasser,G.(2017). Communicationofmonetarypolicyinunconventionaltimes.ECB WorkingPaperno.2080.",2014,institucional,wp_bc_avanzado,ECB Working Paper
2023-21,10,"Coibion,O.andGorodnichenko,Y.(2015). Informationrigidityandtheexpectationsformation process: Asimpleframeworkandnewfacts. AmericanEconomicReview,105(8):2644–78.",2015,ortodoxo,tier1_generalist,American Economic Review
2023-21,11,"Cukierman,A.(2001). Accountability,credibility,transparencyandstabilizationpolicyinthe eurosystem. InTheImpact ofEMUonEuropeandtheDevelopingCountries,pages 40–75. OxfordUniversityPress. deMendonça,H.F.anddeDeus,J.D.B.V.(2019). Centralbankforecastsandprivateexpec- tations: An empirical assessment from three emerging economies. Economic Modelling, 83:234–244.",2001,ortodoxo,libro_mainstream,Libro (Oxford University Press)
2023-21,12,"Ehrmann, M. and Fratzscher, M. (2009). Explaining monetary policy in press conferences. InternationalJournalofCentralBanking,5(2):42–84. El-Shagi,M.andJung,A.(2015). HaveminuteshelpedmarketstopredicttheMPC’smonetary policydecisions? EuropeanJournalofPoliticalEconomy,39:222–234.",2009,ortodoxo,tier1_generalist,Journal of Political Economy
2023-21,13,"Fracasso, A., Genberg, H., and Wyplosz, C. (2003). How do central banks write? Geneva ReportsontheWorldEconomy,2.",2003,desconocido,desconocido,
2023-21,14,"Fujiwara, I. (2005). Is the central bank’s publication of economic forecasts influential? EconomicsLetters,89(3):255–261.",2005,ortodoxo,otros_mainstream,Economics Letters
2023-21,15,"Gamber,E.N.andSmith,J.K.(2009). AretheFed’sinflationforecastsstillsuperiortothe privatesector’s? JournalofMacroeconomics,31(2):240–251.",2009,ortodoxo,macro_monetario,Journal of Macroeconomics
2023-21,16,"Gardner, B., Scotti, C., and Vega, C. (2021). Words speak as loudly as actions: Central bankcommunicationandthe responseofequitypricesto macroeconomicannouncements. JournalofEconometrics(forthcoming). 50",2021,ortodoxo,econometria,Journal of Econometrics
2023-21,17,"Gersbach,H.(2003). Onthenegativesocialvalueofcentralbanks’knowledgetransparency. EconomicsofGovernance,4(2):91–102.",2003,desconocido,desconocido,
2023-21,18,"Hansen,S.andMcMahon,M.(2016). Shockinglanguage: Understandingthemacroeconomic effectsofcentralbankcommunication. JournalofInternationalEconomics,99:S114–S133.",2016,ortodoxo,internacional,Journal of International Economics
2023-21,19,"Hansen, S., McMahon, M., and Prat, A. (2014). Transparency and deliberation within the FOMC:Acomputationallinguisticsapproach. CEPRDiscussionPaper9994.",2014,institucional,wp_multilateral,CEPR Discussion Paper
2023-21,20,"Hansen, S., McMahon, M., and Prat, A. (2018). Transparency and deliberation within the FOMC: A computational linguistics approach. The Quarterly Journal of Economics, 133(2):801–870.",2018,ortodoxo,tier1_generalist,Quarterly Journal of Economics
2023-21,21,"Hansen,S., McMahon,M., andTong, M.(2019). Thelong-runinformation effectofcentral bankcommunication. JournalofMonetaryEconomics,108:185–202.",2019,ortodoxo,macro_monetario,Journal of Monetary Economics
2023-21,22,"Hattori,M.,Kong,S.,Packer,F.,andSekine,T.(2021). Theimpactofregimechangeonthe influenceof the centralbank’s inflation forecasts: Evidencefrom Japan’s shiftto inflation targeting. InternationalJournalofCentralBanking,17(4):257–290.",2021,ortodoxo,macro_monetario,International Journal of Central Banking
2023-21,23,"Hayo,B.,Kutan,A.M.,andNeuenkirch,M.(2012). Communicationmatters: USmonetary policyandcommoditypricevolatility. EconomicsLetters,117(1):247–249.",2012,ortodoxo,otros_mainstream,Economics Letters
2023-21,24,"Hayo, B. and Neuenkirch, M. (2010). Do Federal Reserve communications help predict federalfundstargetratedecisions? JournalofMacroeconomics,32(4):1014–1024.",2010,ortodoxo,macro_monetario,Journal of Macroeconomics
2023-21,25,"Hubert,P.(2014). FOMCforecastsasafocalpointforprivateexpectations. JournalofMoney, CreditandBanking,46(7):1381–1420.",2014,ortodoxo,macro_monetario,"Journal of Money, Credit and Banking"
2023-21,26,"Hubert,P.(2015). Docentralbankforecastsinfluenceprivateagents? Forecastingperformance versussignals. JournalofMoney,CreditandBanking,47(4):771–789.",2015,ortodoxo,macro_monetario,"Journal of Money, Credit and Banking"
2023-21,27,"Hubert, P. (2017). Qualitative and quantitative central bank communication and inflation expectations. TheBEJournalofMacroeconomics,17(1):1–41. 51",2017,ortodoxo,macro_monetario,Journal of Macroeconomics
2023-21,28,"Jain,M.andSutherland,C.S.(2020). Howdocentralbankprojectionsandforwardguidance influenceprivate-sectorforecasts? InternationalJournalofCentral Banking, 16(5):179– 218.",2020,ortodoxo,macro_monetario,International Journal of Central Banking
2023-21,29,"Jung, A. and Kuehl, P. (2021). Can central bank communication help to stabilise inflation expectations? ScottishJournalofPoliticalEconomy,68(3):298–321. López Marmolejo, A. (2013). Deciphering Banco de Mexico’s language (in Spanish). El TrimestreEconómico,80(318):345–370.",2021,ortodoxo,tier1_generalist,Journal of Political Economy
2023-21,30,"Lustenberger, T. and Rossi, E. (2020). Does central bank transparency and communication affectfinancial andmacroeconomicforecasts? InternationalJournalofCentral Banking, 16(2):153–201.",2020,ortodoxo,macro_monetario,International Journal of Central Banking
2023-21,31,"Montes,G.,Oliveira,L.,Curi,A.,andNicolay,R.(2016). Effectsoftransparency,monetary policysignallingandclarityofcentralbankcommunicationondisagreementaboutinflation expectations. AppliedEconomics,48(7):590–607.",2016,desconocido,desconocido,
2023-21,32,"Morris, S. andShin, H. S. (2002). Socialvalueof public information. American Economic Review,92(5):1521–1534.",2002,ortodoxo,tier1_generalist,American Economic Review
2023-21,33,"Nakamura, E. and Steinsson, J. (2018). High-frequency identification of monetary non- neutrality: Theinformationeffect. TheQuarterlyJournalofEconomics,133(3):1283–1330.",2018,ortodoxo,tier1_generalist,Quarterly Journal of Economics
2023-21,34,"Naszodi,A.,Csavas,C.,andFelcser,D.(2016). Whichaspectsofcentralbanktransparency matter? Acomprehensiveanalysisoftheeffectoftransparencyonsurveyforecasts. Inter- nationalJournalofCentralBanking,12(4):147–192. Österholm,P., Dale,S.,andOrphanides,A.(2008). Imperfectcentralbankcommunication- informationversusdistraction. IMFWorkingPapers,pages1–31.",2016,institucional,wp_multilateral,IMF Working Paper
2023-21,35,"Pedersen, M. (2015). Whataffects thepredictions of private forecasters? Therole of central bankforecastsinChile. InternationalJournalofForecasting,31(4):1043–1055. 52",2015,desconocido,desconocido,
2023-21,36,"Romer, C. D. and Romer, D. H. (2000). Federal Reserve information and the behavior of interestrates. AmericanEconomicReview,90(3):429–457.",2000,ortodoxo,tier1_generalist,American Economic Review
2023-21,37,"Svensson,L.E.(2010). Inflationtargeting. InHandbookofMonetaryEconomics,volume3, pages1237–1302.Elsevier.",2010,ortodoxo,libro_mainstream,Libro (Elsevier)
2023-21,38,"Tarkka,J.andMayes,D.G.(1999). Thevalueofpublishingofficialcentralbankforecasts. BankofFinlandResearchDiscussionPaper22.",1999,desconocido,desconocido,
2023-21,39,"Tobback, E., Nardelli, S., and Martens, D. (2017). Between hawks and doves: Measuring centralbankcommunication.ECBWorkingPaperno.2085.",2017,institucional,wp_bc_avanzado,ECB Working Paper
2023-21,40,"Ullrich, K. (2008). Inflation expectations of experts and ECB communication. The North AmericanJournalofEconomicsandFinance,19(1):93–108.",2008,desconocido,desconocido,
2023-21,41,"Woodford,M.(2005). Centralbankcommunicationandpolicyeffectiveness. Technicalreport, NationalBureauofEconomicResearch.",2005,desconocido,desconocido,
2023-21,42,"Zou,H.andHastie,T.(2005). Regularizationandvariableselectionviatheelasticnet. Journal oftheRoyalStatisticalSociety: SeriesB(statisticalmethodology),67(2):301–320. 53 A Tone Index Forthepurposeofthispaper,thetoneofamessagesignalseithertheseverityofinflationary pressuresorthestrengthofeconomicdynamism. Specifically,ahighertonevalueisassociated with higher inflationary pressures or stronger economic ",2005,ortodoxo,otros_mainstream,Economica
2023-18,1,"Alvarez, F. and F. Lippi (2014): “Price setting with menu cost for multiproduct firms,” Econometrica, 82, 89–135.",2014,ortodoxo,tier1_generalist,Econometrica
2023-18,2,"Bils, M. and P. J. Klenow (2004): “Some evidence on the importance of sticky prices,” Journal of Political Economy, 112, 947–985.",2004,ortodoxo,tier1_generalist,Journal of Political Economy
2023-18,3,"Cavallo, A. (2017): “Are online and o✏ine prices similar? Evidence from large multi-channel retailers,” American Economic Review, 107, 283–303. ——— (2018): “Scraped data and sticky prices,” Review of Economics and Statistics, 100, 105–119.",2017,ortodoxo,tier1_generalist,American Economic Review
2023-18,4,"Cortes, P. and J. Pan (2013): “Outsourcing household production: Foreign domes- tic workers and native labor supply in Hong Kong,” Journal of Labor Economics, 31, 327–371.",2013,ortodoxo,otros_mainstream,Journal of Labor Economics
2023-18,5,"Debreu, G. (1959): Theory of Value. An Axiomatic Analysis of Economic Equilib- rium, Cowles Foundation for Research in Economics, Yale University.",1959,desconocido,desconocido,
2023-18,6,"Dhyne, E., J. Konieczny, F. Rumler, and P. Sevestre (2009): “Price rigidity in the Euro Area - An assessment,” European Economy - Economic Papers 380, Directorate General Economic and Financial A↵airs, European Commission. 31",2009,ortodoxo,otros_mainstream,Economica
2023-18,7,"Diewert, W. (2020): “The chain drift problem and multilateral indexes,” Working Paper 20-07, Vancouver School of Economics.",2020,desconocido,desconocido,
2023-18,8,"Diewert, W. E. and K. J. Fox (2020): “Measuring real consumption and CPI bias under lockdown conditions,” Working Paper 27144, National Bureau of Economic Research.",2020,desconocido,desconocido,
2023-18,9,"Eichenbaum, M., N. Jaimovich, S. Rebelo, and J. Smith(2014): “Howfrequent are small price changes?” American Economic Journal: Macroeconomics, 6, 137–55.",2014,ortodoxo,macro_monetario,AEJ: Macroeconomics
2023-18,10,"Fetzer, T. (2022): “Subsidising the spread of COVID-19: Evidence from the UK’s Eat-Out-to-Help-Out scheme,” The Economic Journal, 132, 1200–1217.",2022,ortodoxo,otros_mainstream,Economic Journal
2023-18,11,"Flower, T. and E. Karachalias (2019): “Using alternative data sources in consumer price indices,” O ce for National Statistics. Fouge`re, D., E. Gautier, and H. Le Bihan (2010): “Restaurant prices and the minimum wage,” Journal of Money, Credit and Banking, 42, 1199–1234.",2019,ortodoxo,macro_monetario,"Journal of Money, Credit and Banking"
2023-18,12,"Gilchrist, S., R. Schoenle, J. Sim, and E. Zakrajˇsek (2017): “Inflation dynamics during the financial crisis,” American Economic Review, 107, 785–823. Gonza´lez-Pampillo´n, N., G. Nunez-Chaim, and K. Ziegler (2021): Recover- ing from the First Covid-19 Lockdown: Economic Impacts of the UK’s Eat Out to Help Out Scheme, Centre for Economic Performance, London School of Economics and Political Scien",2017,ortodoxo,tier1_generalist,American Economic Review
2023-18,13,"Hobijn, B., F. Ravenna, and A. Tambalotti (2006): “Menu costs at work: restaurant prices and the introduction of the euro,” The Quarterly Journal of Economics, 121, 1103–1131.",2006,ortodoxo,tier1_generalist,Quarterly Journal of Economics
2023-18,14,"Klenow, P. J. and B. A. Malin(2010): “Microeconomicevidenceonprice-setting,” in Handbook of Monetary Economics, Elsevier, vol. 3, 231–284. Mathieu, E., H. Ritchie, E. Ortiz-Ospina, M. Roser, J. Hasell, C. Appel, C. Giattino, and L. Rode´s-Guirao (2021): “A global database of COVID-19 vaccinations,” Nature Human Behaviour, 5, 947–953.",2010,ortodoxo,libro_mainstream,Libro (Elsevier)
2023-14,1,"Marco Airaudo, Salvatore Nistico`, and Luis-felipe Zanna. Learning, monetary policy, and assetprices. JournalofMoney,CreditandBanking,47(7):1273–1307,2015. Ben S Bernanke and Mark Gertler. Should central banks respond to movements in asset prices? americaneconomicreview,91(2):253–257,2001. JBlanchard,Olivier. Debt,deficits,andfinitehorizons. JournalofPoliticalEconomy,93(2): 223–247,1985. Guillermo",2015,ortodoxo,tier1_generalist,American Economic Review
2023-10,1,"Barišić, P., Kovač, T., and Arčabić, V. (2022). Identifying Aggregate Supply and Demand ShocksinSmallOpenEconomies. EFZGWorkingPaperSeries22-02.",2022,desconocido,desconocido,
2023-10,2,"Brinca,P.,Duarte,J.B.,andFaria-eCastro,M.(2021). MeasuringLaborSupplyandDemand ShocksduringCOVID-19. EuropeanEconomicReview,139:103901.",2021,ortodoxo,otros_mainstream,European Economic Review
2023-10,3,"Carriero, A., Clark, T. E., Marcellino, M., and Mertens, E. (2022). Addressing COVID-19 OutliersinBVARswithStochasticVolatility. ReviewofEconomicsandStatistics,pages 1–38.",2022,ortodoxo,econometria,Review of Economics and Statistics
2023-10,4,"Chavarín, R., Gómez, R., and Salgado, A. (2023). Sectoral Supply and Demand Shocks duringCOVID-19: EvidencefromMexico. LatinAmericanJournalofCentralBanking, 4(1):100083.",2023,desconocido,desconocido,
2023-10,5,"Chiquiar,D.andRamos-Francia,M.(2004). BilateralTradeandBusinessCycleSynchroniza- tion: EvidencefromMexicoandUnitedStatesManufacturingIndustries. BancodeMéxico WorkingPaper2004-05.",2004,institucional,wp_banxico,Banco de México WP
2023-10,6,"Consolo,A.,Foroni,C.,andMartínezHernández,C.(2023).AMixedFrequencyBVARforthe EuroAreaLabourMarket. OxfordBulletinofEconomicsandStatistics,85(5):1048–1082.",2023,ortodoxo,econometria,Oxford Bulletin of Economics and Statistics
2023-10,7,"Cushman,D.O.andZha,T.(1997). IdentifyingMonetaryPolicyinaSmallOpenEconomy underFlexibleExchangeRates. JournalofMonetaryEconomics,39(3):433–448.",1997,ortodoxo,macro_monetario,Journal of Monetary Economics
2023-10,8,"Delajara,M.(2012). SincronizaciónentrelosCiclosEconómicosdeMéxicoyEstadosUnidos: Nuevos Resultados con Base en el Análisis de los Índices Coincidentes Regionales de México. BancodeMéxicoWorkingPaper2012-01.",2012,institucional,wp_banxico,Banco de México WP
2023-10,9,"Dieppe,A.,Legrand,R.,andVanRoye,B.(2016). TheBEARToolbox. ECBWorkingPaper 1934.",2016,institucional,wp_bc_avanzado,ECB Working Paper
2023-10,10,"Foroni, C., Furlanetto, F., and Lepetit, A. (2018). Labor Supply Factors and Economic Fluctuations. InternationalEconomicReview,59(3):1491–1510. 28",2018,desconocido,desconocido,
2023-10,11,"Hartwig,B.(2022). BayesianVARsandPriorCalibrationinTimesofCOVID-19. Studiesin NonlinearDynamics&Econometrics.",2022,desconocido,desconocido,
2023-10,12,"Hernández,J.H.(2004). BusinessCyclesinMexicoandtheUnitedStates: DoTheyShare CommonMovements? JournalofAppliedEconomics,7(2):303–323.",2004,desconocido,desconocido,
2023-10,13,"Kang,W.,Ratti,R.A.,andVespignani,J.(2016). TheImpactofOilPriceShocksontheUS StockMarket: ANoteontheRolesofUSandNon-USOilProduction. EconomicsLetters, 145:176–181.",2016,ortodoxo,otros_mainstream,Economics Letters
2023-10,14,"Kim, S. and Roubini, N. (2000). Exchange Rate Anomalies in the Industrial Countries: A SolutionwithaStructuralVARApproach. JournalofMonetaryEconomics,45(3):561–586. Mejía-Reyes,P.andCampos-Chávez,J.(2011). AretheMexicanStatesandtheUnitedStates BusinessCyclesSynchronized?: Evidencefrom theManufacturingProduction. Economía Mexicana.Nuevaépoca,20(1):79–112.",2000,ortodoxo,macro_monetario,Journal of Monetary Economics
2023-10,15,"Mundell, R. A. (1961). A Theory of Optimum Currency Areas. The American Economic Review,51(4):657–665.",1961,ortodoxo,tier1_generalist,American Economic Review
2023-10,16,"Shapiro, A. H.(2022). Decomposing Supply and DemandDrivenInflation. Federal Reserve BankofSanFranciscoWorkingPapers2022-18.",2022,institucional,wp_bc_avanzado,Federal Reserve
2023-09,1,"Alvarez, F., H. Le Bihan, and F. Lippi (2016): “The real e↵ects of monetary shocks in sticky price models: A su cient statistic approach,” American Economic Review, 106, 2817–51.",2016,ortodoxo,tier1_generalist,American Economic Review
2023-09,2,"Aucremanne, L. and E. Dhyne (2004): “How frequently do prices change? Evidence based on the micro data underlying the Belgian CPI,” Evidence Based on the Micro Data Underlying the Belgian CPI (April 2004).",2004,desconocido,desconocido,
2023-09,3,"Auer, J. and I. Boettcher (2017): “From price collection to price data analytics,” Statistics Austria presentation at the 2017 Ottawa Group.",2017,desconocido,desconocido,
2023-09,4,"Baumgartner, J., E. Glatzer, F. Rumler, and A. Stiglbauer (2005): “How frequently do consumer prices change in Austria? Evidence from micro CPI data,” ECB Working Paper No. 523.",2005,institucional,wp_bc_avanzado,ECB Working Paper
2023-09,5,"Bils, M. and P. J. Klenow (2004): “Some evidence on the importance of sticky prices,” Journal of Political Economy, 112, 947–985.",2004,ortodoxo,tier1_generalist,Journal of Political Economy
2023-09,6,"Cavallo, A. (2017): “Are online and o✏ine prices similar? Evidence from large multi-channel retailers,” American Economic Review, 107, 283–303. ——— (2018): “Scraped data and sticky prices,” Review of Economics and Statistics, 100, 105–119.",2017,ortodoxo,tier1_generalist,American Economic Review
2023-09,7,"Coibion, O., Y. Gorodnichenko, and G. H. Hong (2015): “The cyclicality of sales, regular and e↵ective prices: Business cycle and policy implications,” American Economic Review, 105, 993–1029.",2015,ortodoxo,tier1_generalist,American Economic Review
2023-09,8,"Coronado, H., E. Lahura, and M. Vega (2020): “¿Qu´e tan r´ıgidos son los precios en l´ınea? Evidencia para Peru´ usando big data,” Banco Central de Reserva del Peru´ DT. No. 2020-018. Costa Dias, M., D. A. Dias, and P. Duarte Neves (2008): “Stylised features of consumer price setting behaviour in Portugal: 1992–2001,” Portuguese Economic Journal, 7, 75–99. DellaVigna, S. and M. Gentzkow (2019): “U",2020,ortodoxo,tier1_generalist,Quarterly Journal of Economics
2023-09,9,"Dixon, H. D. and K. Tian (2017): “What we can learn about the behaviour of firms from the average monthly frequency of price-changes: An application to the UK CPI data,” Oxford Bulletin of Economics and Statistics, 79, 907–932.",2017,ortodoxo,econometria,Oxford Bulletin of Economics and Statistics
2023-09,10,"Eichenbaum, M., N. Jaimovich, and S. Rebelo (2011): “Reference prices, costs, and nominal rigidities,” American Economic Review, 101, 234–262.",2011,ortodoxo,tier1_generalist,American Economic Review
2023-09,11,"Flower, T. (2019): “Using alternative data sources in consumer prices, UK,” O ce for National Statistics.",2019,desconocido,desconocido,
2023-09,12,"Gagnon, E. (2009): “Price setting during low and high inflation: Evidence from Mexico,” The Quarterly Journal of Economics, 124, 1221–1263. Gal´ı, J. (2015): Monetary policy, inflation, and the business cycle: an introduction to the new Keynesian framework and its applications, Princeton University Press.",2009,ortodoxo,tier1_generalist,Quarterly Journal of Economics
2023-09,13,"Glassock, A. and M. Holt (2019): “Experimental clothing indexes using Aus- tralian web scraped data,” in Papers presented at the International Meeting of the Group of Experts on Consumer Price Indices.",2019,desconocido,desconocido,
